id,title,category,subcategory,description,images,specifications
140,"Женский велосипед Aspect OASIS 16"" на рост 160-165 см",Спорт и отдых,Велосипеды,"

Изящный спортивный велосипед Aspect Oasis станет отличным спутником на прогулке. Удивительный дизайн этого байка не оставит равнодушным никого, а надёжные компоненты позволят чувствовать себя уверенно на дороге! Эргономичная конструкция седла позволяет удобно устроится на железном коне и мчаться вперёд – на встречу новым впечатлениям! 
","['/upload/product/637/dc0ef8403473a860cbf539b9f89f2cb5/full.jpg', '/upload/product/637/29126972d8935b97c1779c3f36536cd7/full.jpg']","{'Тип': 'Горный', 'Пол': 'Женский', 'Рост велосипедиста': '160-165 см', 'Диаметр': '26', 'Вилка': 'Suntour XCT DS 100mm', 'Тип тормозов': 'Ободные', 'Рама': 'ALU 6061 Hydroformed/Алюминий', 'Количество скоростей': '21', 'Вес': '13.10 кг'}"
141,"Женский велосипед Aspect OASIS 18"" на рост 170-175 см",Спорт и отдых,Велосипеды,"

Изящный спортивный велосипед Aspect Oasis станет отличным спутником на прогулке. Удивительный дизайн этого байка не оставит равнодушным никого, а надёжные компоненты позволят чувствовать себя уверенно на дороге! Эргономичная конструкция седла позволяет удобно устроится на железном коне и мчаться вперёд – на встречу новым впечатлениям! 
","['/upload/product/638/8b8353001d14505f6ad66dbecbdb6d0e/full.jpg', '/upload/product/638/a2df670beaa803e84b40fb586ceedd0b/full.jpg', '/upload/product/638/208ebc87f507973a7b850ccfae863347/full.jpg', '/upload/product/638/5c1cabbe98d0c0201a0049920a668d38/full.jpg', '/upload/product/638/83eca19180118cef4642726509d08fac/full.jpg', '/upload/product/638/370f703e78fa2f81899002b25cbad2ef/full.jpg', '/upload/product/638/e7e172cc8f7cce04853a981ca172285c/full.jpg', '/upload/product/638/fdba90504d7651df507bc696156de67b/full.jpg']","{'Тип': 'Горный', 'Пол': 'Женский', 'Рост велосипедиста': '170-175 см', 'Диаметр': '26', 'Вилка': 'Suntour XCT DS 100mm', 'Тип тормозов': 'Ободные', 'Рама': 'ALU 6061 Hydroformed/Алюминий', 'Количество скоростей': '21', 'Вес': '13.10 кг'}"
142,"Женский комфортный велосипед Aspect СITYLIFE 16"" на рост 160-165 см",Спорт и отдых,Велосипеды,"Велосипед для девушек, который отлично подходит для городских прогулок. Катайтесь с комфортом благодаря мягкой вилке и посадке с прямой спиной. Заниженная рама делает ваш образ ещё более элегантным и женственным. Модель оснащена 21-скоростной трансимиссией марки Shimano.","['/upload/product/639/25530871e33012523748957d67e644a2/full.jpg', '/upload/product/639/f4a83aa2c8142d705c86cfcb881836ef/full.jpg', '/upload/product/639/be70bf55b90f487ad07c0f8d5d49c7bf/full.jpg', '/upload/product/639/5a9f6cc9538602add5e41611751036f0/full.jpg', '/upload/product/639/58f4649b40cf05f9628d1d0fc3aa977e/full.jpg', '/upload/product/639/de20256797250082f1781e03759e9e7e/full.jpg', '/upload/product/639/7af6bf77d65483fc04c5e24288948309/full.jpg', '/upload/product/639/704f3e35e2a8ce52ddfd9292a331cf64/full.jpg', '/upload/product/639/5a8340f80a4747df7b616780ab71bd14/full.jpg']","{'Тип': 'Комфортный', 'Пол': 'Женский', 'Рост велосипедиста': '160-165 см', 'Диаметр': '26', 'Вилка': 'Suntour XCT DS 100mm', 'Тип тормозов': 'Ободные', 'Рама': 'ALU 6061 COMFORT', 'Количество скоростей': '21', 'Вес': '14.60 кг'}"
143,Мужской комфортный велосипед Aspect WEEKEND 18 на рост 175-180 см,Спорт и отдых,Велосипеды,"

Хотите провести свой выходной с пользой и прокатиться по городу, любуясь парками и архитектурой? Велосипед Aspect WEEKEND – лучший вариант для такой прогулки! Благодаря комфортной посадке вы сможете кататься дольше, чем на спортивном велосипеде, а навеска этой модели позволит спокойно преодалевать бардюры и небольшие неровности дороги. 
","['/upload/product/640/9e03aebbf0b22c0ea791fddf56663b3e/full.jpg', '/upload/product/640/4471fbbf3bfc5be5ef20914cd7c91905/full.jpg', '/upload/product/640/fa34ca0636a8c8e516f1b72a4f8d0d8d/full.jpg', '/upload/product/640/fe30639fc58749a29ae60873ab242edf/full.jpg', '/upload/product/640/b989499da27d36d2cca85fc01e98d3aa/full.jpg', '/upload/product/640/26c90fe96611a153d758e190b0d2830a/full.jpg', '/upload/product/640/4d231ac81c886b9f5b7c45299bbf8d61/full.jpg', '/upload/product/640/b42168c13021233b7e924611bd6d78c7/full.jpg', '/upload/product/640/d178f0a308d96df38b41481ff0b39964/full.jpg', '/upload/product/640/d95a97e2df875086dd73a2bffb7fba9e/full.jpg']","{'Тип': 'Комфортный', 'Пол': 'Мужской', 'Рост велосипедиста': '175-180 см', 'Диаметр': '26', 'Вилка': 'Suntour XCT DS 100mm', 'Тип тормозов': 'Ободные', 'Рама': 'ALU 6061 COMFORT', 'Количество скоростей': '21', 'Вес': '15.28 кг'}"
144,Подростковый велосипед для девочки Aspect ANGEL на рост 130-150 см,Спорт и отдых,Велосипеды,"Aspect ANGEL – это подростковый велосипед для девочек от популярного немецкого производителя. Модель имеет нежный лёгкий дизайн, оснащена надёжным навесным оборудованием от бренда Shimano и 24-дюймовыми удобными колёсами. Подойдёт для девочки 9-12 лет.","['/upload/product/641/8b0e833daf19d8d326a7c3cf2de57724/full.jpg', '/upload/product/641/fc846a18ebe4d1a16c699f8293221a8b/full.jpg', '/upload/product/641/0e1b8953c4aea98f52c57288378ec30a/full.jpg', '/upload/product/641/98e44f4f5e082ded70d99e5e3917b82b/full.jpg', '/upload/product/641/4c3377d9f37a446d690bc6cca7143092/full.jpg', '/upload/product/641/d0046c1a52901686c3d4b6ac058f29af/full.jpg', '/upload/product/641/7e481fc92b4597bd31c08e7deef096ad/full.jpg', '/upload/product/641/8f11ecda96e3d46e0a89a140db222e12/full.jpg', '/upload/product/641/b02ddb5ffe5cb5ac72e346c7c28fdf09/full.jpg']","{'Рост велосипедиста': '130-150 см', 'Вилка': 'Zoom CH-565 50mm', 'Тип тормозов': 'Ободные', 'Рама': 'ALU 6061', 'Количество скоростей': '21', 'Вес': '11.90 кг'}"
145,Подростковый велосипед для мальчика Aspect WINNER на рост 130-150 см,Спорт и отдых,Велосипеды,"

Aspect WINNER – байк для юных покорителей дорог. Надёжная трансмиссия от известного производителя Shimano работает без сбоев, а мягкая вилка позволит с комфортом проезжать по неровным дорогам и преодолевать небольшие бордюры, что несомненно увлечёт вашего ребёнка! 
","['/upload/product/642/c592eeda800511999119e1915c383639/full.jpg', '/upload/product/642/1cf81992edf325e38703447157ec8464/full.jpg', '/upload/product/642/8ca2b07b46bf8c67bd2a27ce7aa9b06a/full.jpg', '/upload/product/642/5e3d02a9662034e66d2d29cb89b74543/full.jpg', '/upload/product/642/5664ee46346b331b60384f3e7949c1b9/full.jpg', '/upload/product/642/6c8f9cddae2fde35fcbf608c2a608934/full.jpg', '/upload/product/642/dc4a2fa1cc2a11e44d8f8a62b600575a/full.jpg', '/upload/product/642/d4c7e4b38feb68ad5822c3130bee0504/full.jpg', '/upload/product/642/abf5e02f0aad2f69c204a70022d78d4e/full.jpg', '/upload/product/642/c0fdf4b2664c3df51c9435f695a502d0/full.jpg']","{'Рост велосипедиста': '130-150 см', 'Вилка': 'Zoom CH-565 50mm', 'Тип тормозов': 'Дисковые механические', 'Рама': 'ALU 6061', 'Количество скоростей': '21', 'Вес': '12.60 кг'}"
146,Детский велосипед для мальчика Aspect CHAMPION на рост 120-140 см,Спорт и отдых,Велосипеды,"Детские велосипеды немецкого бренда Aspect – отличный выбор для того, чтобы научить ваше чадо кататься на байке. Champion прекрасно подойдёт ребёнку в возрасте примерно 5-9 лет. Несомненно для ребёнка и родителя будет познавательно и весело прокатиться вместе на велосипедах! Так что не забудьте взять велосипед и для себя!","['/upload/product/643/39b3c085eb351490fc89034e255a15a1/full.jpg', '/upload/product/643/71fdc9700be878fd13e454a15742ea27/full.jpg', '/upload/product/643/feff7d82f95c2260c0aff3aea45f33a5/full.jpg', '/upload/product/643/eda36a1c7da5b6710337eae9c2c12568/full.jpg', '/upload/product/643/0d2e0590c0045e08249775197f429630/full.jpg', '/upload/product/643/f95940e170e6b77cdc883fd2c91d2ad5/full.jpg', '/upload/product/643/9dd13c0d350f6639fe4b11a1c717355f/full.jpg', '/upload/product/643/0533740b8643a571a88b517bbe0aa459/full.jpg', '/upload/product/643/6b6f42a7843494ab334b85e3479c7603/full.jpg', '/upload/product/643/1d9c820ed63dc53ae3e9018f06481eb1/full.jpg', '/upload/product/643/fd905f740d96ee58fdc1f1733b5ac8f9/full.jpg']","{'Тип': 'Детский', 'Пол': 'Для мальчика', 'Рост велосипедиста': '120-140 см', 'Диаметр': '20', 'Вилка': 'Zoom CH-280E 30mm', 'Тип тормозов': 'Ободные', 'Рама': 'ALU 6061', 'Количество скоростей': '6', 'Вес': '10.90 кг'}"
147,Детский велосипед для девочки Aspect GALAXY на рост 120-140 см,Спорт и отдых,Велосипеды,"

Сделайте сюрприз вашей маленькой принцессе – отправляйтесь на велопрогулку вместе с Aspect Galaxy. Надёжный немецкий велосипед с проверенным оборудованием позволит ребёнку с любой подготовкой легко и быстро помчаться на встречу приключениям! 
","['/upload/product/644/72a7c79bf25e3b4d37b3778abf73f83a/full.jpg', '/upload/product/644/de21281cf2eba9fc4db041f69a494780/full.jpg', '/upload/product/644/b87e637f0a2328d800f43f27bcd9db14/full.jpg', '/upload/product/644/f67b35b87c77cb6ab4779499d7c5cfc3/full.jpg', '/upload/product/644/83add1c9e24c8239e2ee9246ff46d81b/full.jpg', '/upload/product/644/cee272d7ffb2ca0aac6dd4168c1bcd9b/full.jpg', '/upload/product/644/72159bae9fcb53974acd15199713c4cc/full.jpg', '/upload/product/644/df187e925978e801ef50aa678fb52a6d/full.jpg', '/upload/product/644/3adfee9408288cbdfe42a1fe7c36ca9d/full.jpg', '/upload/product/644/475336d485a41501af5efe34960f4f3f/full.jpg', '/upload/product/644/977dff8258b20acf0804e26d6ae60491/full.jpg', '/upload/product/644/eb373e3be6efc4af944064f53fc1b9ae/full.jpg']","{'Тип': 'Детский', 'Пол': 'Для девочки', 'Рост велосипедиста': '120-140 см', 'Диаметр': '20', 'Вилка': 'Zoom CH-280E 30mm', 'Тип тормозов': 'Ободные', 'Рама': 'ALU 6061', 'Количество скоростей': '6', 'Вес': '10.9 кг'}"
148,"Детский велосипед Format Kids 16"" на рост 100-120 см",Спорт и отдых,Велосипеды,"Детский велосипед Format Kids 16"" – настоящая находка для маленьких спортсменов. Благодаря дополнительным боковым колёсам, которые легко снимаются, ребёнок быстро научится кататься! Используйте весь потенциал юного экстремала и отправляйтесь на прогулку!","['/upload/product/650/41a80eef6929bc202b486eadf56819a2/full.jpg', '/upload/product/650/0c0ef97a1de7d18c49cf1186c5706174/full.jpg', '/upload/product/650/1f0ee2b7a684dc7d020dd348179c3a8f/full.jpg', '/upload/product/650/008b4d4ed8fe67421b6caa31efa6aef7/full.jpg', '/upload/product/650/9eb1e737c61870f01e82cc2e3e50f95b/full.jpg', '/upload/product/650/766d045d889da23e2dd7e4f115680b71/full.jpg', '/upload/product/650/772821ff500e8ef66c013f33150f8d51/full.jpg', '/upload/product/650/c1aaba2a9f6c8f54cdd41bfc58b23ce4/full.jpg']","{'Тип': 'Детский', 'Пол': 'Детский (Унисекс)', 'Рост велосипедиста': '100-120 см', 'Диаметр': '16', 'Вилка': 'Алюминиевый сплав 6061', 'Тип тормозов': 'Ободные', 'Рама': 'Алюминиевый сплав 6061', 'Количество скоростей': '1', 'Вес': '8.00 кг'}"
149,"Горный велосипед Aspect Stimul 20"" на рост 185-190 см",Спорт и отдых,Велосипеды,"

Отправляйтесь в путешествие или на прогулку! Велосипед Aspect Stimul – отличный способ провести время с пользой и удовольствием. Благодаря мягкой вилке байк легко проедет по пересечённой местности, что позволяет спокойно отправиться на нём в лесной поход. 
","['/upload/product/1223/04f584eaffc4bef23e16500704d85c75/full.jpg', '/upload/product/1223/5d1a1d052f7fbf0558376bc4a468e40f/full.jpg', '/upload/product/1223/0ecb413f5fe0f7510da2eccfa618c217/full.jpg', '/upload/product/1223/1fee0e52c078e730afedaad3970bb667/full.jpg', '/upload/product/1223/2a828d22698dd31f9ad7f8d9b285d7f8/full.jpg', '/upload/product/1223/09f365e1f7cbaeb32aaf462532334574/full.jpg', '/upload/product/1223/78bc5c6d1c97523df39ec3fb5fa08cde/full.jpg', '/upload/product/1223/92ead77ccd198686e79b6f7c609d44f0/full.jpg', '/upload/product/1223/99d7064a43a63cb40eaf504e4ca78425/full.jpg', '/upload/product/1223/361ea8d46c0c3cef0e732967a0cc6f96/full.jpg', '/upload/product/1223/249442145baa8fe03aa3c9290e4316a0/full.jpg', '/upload/product/1223/a2c054b3e428637f3e88747a7f2d0ece/full.jpg', '/upload/product/1223/b3f8b52204c9b8e4e441679120467aa3/full.jpg', '/upload/product/1223/bef2b82c7e9474157079428cadabac62/full.jpg', '/upload/product/1223/db411a609ef81a7cbaee2cb376313afe/full.jpg', '/upload/product/1223/e8e9fc47f9beb48e715838d3ff72d2e7/full.jpg', '/upload/product/1223/f5c494157e0ba7df7dd914a89f35fedf/full.jpg', '/upload/product/1223/f23d0d5552bf45bf40a1107b6f967ec7/full.jpg', '/upload/product/1223/f61a65ef8302c1ec9ba4883c810af8fe/full.jpg']","{'Тип': 'Горный', 'Пол': 'мужской', 'Рост велосипедиста': '185-190 см', 'Диаметр': '27.5', 'Вилка': 'Suntour XCT DS 100mm', 'Тип тормозов': 'Дисковые гидравлические', 'Рама': 'ALU 6061 Hydroformed DoubleButted', 'Количество скоростей': '24'}"
150,"Горный велосипед Aspect Stimul 18"" на рост 175-180 см",Спорт и отдых,Велосипеды,"

Отправляйтесь в путешествие или на прогулку! Велосипед Aspect Stimul – отличный способ провести время с пользой и удовольствием. Благодаря мягкой вилке байк легко проедет по пересечённой местности, что позволяет спокойно отправиться на нём в лесной поход. 
","['/upload/product/1224/04f584eaffc4bef23e16500704d85c75/full.jpg', '/upload/product/1224/5d1a1d052f7fbf0558376bc4a468e40f/full.jpg', '/upload/product/1224/1fee0e52c078e730afedaad3970bb667/full.jpg', '/upload/product/1224/a2c054b3e428637f3e88747a7f2d0ece/full.jpg', '/upload/product/1224/0ecb413f5fe0f7510da2eccfa618c217/full.jpg', '/upload/product/1224/2a828d22698dd31f9ad7f8d9b285d7f8/full.jpg', '/upload/product/1224/09f365e1f7cbaeb32aaf462532334574/full.jpg', '/upload/product/1224/78bc5c6d1c97523df39ec3fb5fa08cde/full.jpg', '/upload/product/1224/92ead77ccd198686e79b6f7c609d44f0/full.jpg', '/upload/product/1224/99d7064a43a63cb40eaf504e4ca78425/full.jpg', '/upload/product/1224/361ea8d46c0c3cef0e732967a0cc6f96/full.jpg', '/upload/product/1224/249442145baa8fe03aa3c9290e4316a0/full.jpg', '/upload/product/1224/b3f8b52204c9b8e4e441679120467aa3/full.jpg', '/upload/product/1224/bef2b82c7e9474157079428cadabac62/full.jpg', '/upload/product/1224/db411a609ef81a7cbaee2cb376313afe/full.jpg', '/upload/product/1224/e8e9fc47f9beb48e715838d3ff72d2e7/full.jpg', '/upload/product/1224/f5c494157e0ba7df7dd914a89f35fedf/full.jpg', '/upload/product/1224/f23d0d5552bf45bf40a1107b6f967ec7/full.jpg', '/upload/product/1224/f61a65ef8302c1ec9ba4883c810af8fe/full.jpg']","{'Тип': 'Горный', 'Пол': 'мужской', 'Рост велосипедиста': '175-180 см', 'Диаметр': '27.5', 'Вилка': 'Suntour XCT DS 100mm', 'Тип тормозов': 'Дисковые гидравлические', 'Рама': 'ALU 6061 Hydroformed DoubleButted', 'Количество скоростей': '24'}"
151,"Горный велосипед Aspect Stimul 16"" на рост 155-170 см",Спорт и отдых,Велосипеды,"

Отправляйтесь в путешествие или на прогулку! Велосипед Aspect Stimul – отличный способ провести время с пользой и удовольствием. Благодаря мягкой вилке байк легко проедет по пересечённой местности, что позволяет спокойно отправиться на нём в лесной поход. 
","['/upload/product/1225/5d1a1d052f7fbf0558376bc4a468e40f/full.jpg', '/upload/product/1225/04f584eaffc4bef23e16500704d85c75/full.jpg', '/upload/product/1225/1fee0e52c078e730afedaad3970bb667/full.jpg', '/upload/product/1225/a2c054b3e428637f3e88747a7f2d0ece/full.jpg', '/upload/product/1225/0ecb413f5fe0f7510da2eccfa618c217/full.jpg', '/upload/product/1225/2a828d22698dd31f9ad7f8d9b285d7f8/full.jpg', '/upload/product/1225/09f365e1f7cbaeb32aaf462532334574/full.jpg', '/upload/product/1225/78bc5c6d1c97523df39ec3fb5fa08cde/full.jpg', '/upload/product/1225/92ead77ccd198686e79b6f7c609d44f0/full.jpg', '/upload/product/1225/99d7064a43a63cb40eaf504e4ca78425/full.jpg', '/upload/product/1225/361ea8d46c0c3cef0e732967a0cc6f96/full.jpg', '/upload/product/1225/249442145baa8fe03aa3c9290e4316a0/full.jpg', '/upload/product/1225/b3f8b52204c9b8e4e441679120467aa3/full.jpg', '/upload/product/1225/bef2b82c7e9474157079428cadabac62/full.jpg', '/upload/product/1225/db411a609ef81a7cbaee2cb376313afe/full.jpg', '/upload/product/1225/e8e9fc47f9beb48e715838d3ff72d2e7/full.jpg', '/upload/product/1225/f5c494157e0ba7df7dd914a89f35fedf/full.jpg', '/upload/product/1225/f23d0d5552bf45bf40a1107b6f967ec7/full.jpg', '/upload/product/1225/f61a65ef8302c1ec9ba4883c810af8fe/full.jpg']","{'Тип': 'Горный', 'Пол': 'мужской', 'Рост велосипедиста': '155-170 см', 'Диаметр': '27.5', 'Вилка': 'Suntour XCT DS 100mm', 'Тип тормозов': 'Дисковые гидравлические', 'Рама': 'ALU 6061 Hydroformed DoubleButted', 'Количество скоростей': '24'}"
152,Женский горный велосипед Format 7713 на рост 155-170 см,Спорт и отдых,Велосипеды,"Изящный спортивный велосипед Format 7713 станет отличным спутником на прогулке. Удивительный дизайн этого байка не оставит равнодушным никого, а надёжные компоненты позволят чувствовать себя уверенно на дороге! Эргономичная конструкция седла позволяет удобно устроится на железном коне и мчаться вперёд – на встречу новым впечатлениям!","['/upload/product/1227/576cf652a4a2002a247048e4da0326e2/full.jpg', '/upload/product/1227/af471a9425ae94334ee9536543dd262d/full.jpg']","{'Тип': 'Горный', 'Пол': 'женский', 'Рост велосипедиста': '155-170 см', 'Диаметр': '26', 'Вилка': 'SR Suntour XCT 26', 'Тип тормозов': 'Ободные', 'Рама': '26', 'Количество скоростей': '21', 'Вес': '13.70 кг'}"
153,Горный велосипед Aspect Stimul 29 на рост 190-200 см,Спорт и отдых,Велосипеды,"Отправляйтесь в путешествие или на прогулку! Велосипед Aspect Stimul 29 – отличный способ провести время с пользой и удовольствием. Благодаря мягкой вилке байк легко проедет по пересечённой местности, что позволяет спокойно отправиться на нём в лесной поход.","['/upload/product/983/bf338a1377a275d6d592722368d739c9/full.jpg', '/upload/product/983/b1fe51a412ff4a5fa2a96f3010735a04/full.jpg']","{'Тип': 'Горный', 'Пол': 'Мужской', 'Рост велосипедиста': '190-200 см', 'Диаметр': '29""', 'Вилка': 'Suntour XCT DS 100mm', 'Тип тормозов': 'Дисковые гидравлические', 'Рама': 'ALU 6061 Hydroformed', 'Количество скоростей': '24', 'Вес': '13.90 кг'}"
154,Электровелосипед BearBike Vienna на рост 160-175 см,Спорт и отдых,Велосипеды,"Электровелосипед BearBike Vienna – это стильный дизайн и хорошие технические параметры. Крепкие, устойчивые к восьмёркам колёса и качественные покрышки Kenda Kontakt, 20x1.95"". В конструкции байка присутствуют дисковые механические тормоза Tektro M280, которые не подведут даже в плохую и «некатабельную» погоду. Литиевая батарея 36V7 / 8Ah позволяет наслаждаться движением максимально долго.","['/upload/product/1243/ea8a36e346730b067b85d62603903b3f/full.jpg', '/upload/product/1243/1ef4f3ffc19a34b8284bb3df7d5f3c32/full.jpg', '/upload/product/1243/22c013c7ed6a76598cd4176c31e64779/full.jpg', '/upload/product/1243/ff40a676926ffdaf11a744c321341d4a/full.jpg', '/upload/product/1243/cea9baca6175e20c475f42f6cadaa892/full.jpg', '/upload/product/1243/cab1e5b7b308210f6735a93536848eb7/full.jpg', '/upload/product/1243/474d3d4d8faf29653686e46dae15da4f/full.jpg', '/upload/product/1243/58ecfde7d6faa1e1e860a604b19f3b11/full.jpg', '/upload/product/1243/c9d7589c7e979f0aff309664a6ec45d6/full.jpg', '/upload/product/1243/7348ad0015fde4cab7a9f3be05dae619/full.jpg', '/upload/product/1243/16cefa9d788eb3f9eea5d75adeaf5665/full.jpg', '/upload/product/1243/c96a3914f85eb0c25b1c4db7a899ca01/full.jpg', '/upload/product/1243/98cce68f50a407256441b57953138753/full.jpg']","{'Тип': 'Электровелосипед', 'Пол': 'Унисекс', 'Рост велосипедиста': '160-175 см', 'Вилка': 'Алюминий', 'Аккумулятор': 'Литиевая батарея 36V7 / 8Ah', 'Тип тормозов': 'Дисковые механические', 'Количество скоростей': '6'}"
