id,title,category,subcategory,description,images,specifications
469,"Телевизор Samsung 50""UE50MU6100U",Аудио- и видеотехника,Телевизоры,"Телевизор Samsung 50""UE50MU6100U с огромным экраном отлично подойдёт для ваших презентаций и просмотров кинолент дома! Высокое разрешение и прекрасное качество UHD позволяют полностью погрузится в информацию на экране, будь то фильм или презентация. Благодаря современным технологиям Samsung 50""UE50MU6100U сразу распознаёт устройства, находящиеся перед ним и выводит их на экран, предлагая выбрать необходимое для подключения. Также телевизор оснащён современной технологией Smart TV.","['/upload/product/69/3a130294791500fbaf8c5ac7f0ef8add/full.jpg', '/upload/product/69/38eec4a81744b440acd96844b220ad3f/full.jpg']","{'Диагональ': '50', 'Разрешение экрана': '3840х2160 Пикс (Ultra HD)', 'Звук': 'Dolby Digital Plus  2 x 10 Вт', 'Размеры': '72.4х112.9х31 см', 'Пульт ДУ': 'Комплект/смартфон', 'Встроенный модуль Wi-Fi': 'Да', 'Чтение файлов': 'MP3, H.264, MPEG4, DivX, JPEG', 'Поддержка Smart TV': 'Да', 'USB порт': 'Есть, 2шт', 'HDMI': 'Есть, 3 шт', 'Особенность': 'Технология HDR', 'LAN': 'Есть', 'Разъем для модуля DVB CAM': 'Есть', 'Вес': '13.6 кг'}"
470,"131"" (333 см) Экран для проектора Lumien Master View LMV-100105",Оборудование,Проекционные экраны,"Экран для проектора Lumien Master View LMV-100105 диагональю 131 дюйм сделает просмотр видео ещё более увлекательным! 
Lumien Master View LMV-100105 может стать прекрасным помощником как на презентации, так и при домашнем просмотре фильмов на проекторе. Экран покрыт специальным матовым слоем, который препятствует возникновению бликов. Телескопическая стойка экрана легко складывается.",['/upload/product/75/93325be3599e7631ddd73755f9241c4d/full.jpg'],"{'Диагональ': '131', 'Вес': '10 кг', 'Пульт ДУ': 'Нет', 'Рабочая поверхность': '236x236 см', 'Покрытие': 'Matte White Fiberglass', 'Установка': 'На штативе', 'Штатив': 'Да', 'Электронный привод': 'Нет', 'Проекция': 'Прямая', 'Угол обзора': '160°', 'Коэффициент усиления': '1'}"
471,Лазерный проектор Xiaomi MiJia Laser Projection,Оборудование,Проекторы,"Сделайте просмотр фильмов и презентаций ещё более удобным при помощи лазерного проектора Xiaomi MiJia Laser Projection! Этот лазерный проектор подойдёт и для проведения презентации, ведь в комплекте идёт очень удобный пульт. На корпусе проектора есть два входа для USB, 3 под HDMI, так что проблем с носителями видеоматериалов не возникнет.
Можно использовать проектор дома для просмотра фильмов, не мешая домочадцам. Для этого в Xiaomi MiJia Laser Projection есть Mini-Jack для подключения наушников.","['/upload/product/77/e4e5e46a917ef0ef7baff2442029d543/full.jpg', '/upload/product/77/401b6ed41e6a84dd8c77162bfada974b/full.jpg', '/upload/product/77/f7b9ba1826c17daac7c84af2ba765b8e/full.jpg', '/upload/product/77/6e847d0cffcb1f879b97aea9beea9df0/full.jpg', '/upload/product/77/f4368201fc67705b74068c92ed50cc80/full.jpg']","{'Фокусное расстояние, м': '0.14-0.5 м', 'Размер изображения, диагональ': '42-150 дюймов', 'Разрешение экрана': '1920x1080', 'Встроенный модуль Wi-Fi': 'Да', 'HDMI': 'Есть, 3 шт', 'Mini-Jack': 'Есть', 'USB порт': 'Есть, 2шт', 'Размеры': '410х291х88 мм', 'Вес': '7 кг'}"
472,Проектор Epson EH-TW610,Оборудование,Проекторы,"Проектор Epson EH-TW610 способен вводить изображение на экран диагональю до 300 дюймов! Наслаждайтесь любимыми фильмами на большом экране в качестве FullHD. А специальная технология 3LCD сделает просмотр ещё более приятным, ведь цвет изображения будет выглядеть максимально живыми.","['/upload/product/1472/f65bf35cf525cb28454b8d66b03c1e76/full.jpg', '/upload/product/1472/5b2b15b5931902b2bd9560b229db779f/full.jpg', '/upload/product/1472/a5c2f54ab9097ad017524d807b3bda24/full.jpg', '/upload/product/1472/f6bce2a27759f325b64e1d2b3dd06abe/full.jpg', '/upload/product/1472/d549ad2d7f6b3621e552a93d495fdaa9/full.jpg', '/upload/product/1472/ed2e9a69755d0c99aa612a115754c65c/full.jpg']","{'Фокусное расстояние, м': '18.2 - 29.2', 'Цветовая яркость, лм': '3000', 'Размер изображения, диагональ': '0.76 - 7.62', 'Уровень шума, дБ': '28', 'Контрастность': '10000', 'Поддержка 3D': 'нет', 'Равномерность яркости, в процентах': '87', 'Коррекция трапецеидального искажения по горизонтали/по вертикали': '30/30', 'Miracast': 'нет', 'Разрешение экрана': 'FullHD (1920x1080)', 'Фокусировка': 'Ручная', 'Встроенный динамик': '2 Вт', 'Встроенный модуль Wi-Fi': 'Да', 'HDMI': 'Есть, 2 шт', 'USB Display 3 в 1': 'Есть', 'USB порт': 'Есть, 2шт', 'Дисплей': '0.61', 'Размеры': '252x302x87 мм', 'Вес': '2.7'}"
473,"Телевизор Samsung 65"" UUE65NU7100U",Аудио- и видеотехника,Телевизоры,"Телевизор Samsung 65""UE65MU6100 с огромным экраном отлично подойдёт для ваших презентаций и просмотров кинолент дома! Высокое разрешение и прекрасное качество UHD позволяют полностью погрузится в информацию на экране, будь то фильм или презентация. Благодаря современным технологиям Samsung 65""UE65MU6100 сразу распознаёт устройства, находящиеся перед ним и выводит их на экран, предлагая выбрать необходимое для подключения. Также телевизор оснащён современной технологией Smart TV.","['/upload/product/68/6c627a5698b864b9929357ad4fcdb072/full.jpg', '/upload/product/68/82d677fd34ae1008e38ca251faece336/full.jpg', '/upload/product/68/7740afa965ce5fe034b7feeadc1c7430/full.jpg', '/upload/product/68/3514ebdc4854c4f2ca65f397ed522188/full.jpg']","{'Диагональ': '65', 'Разрешение экрана': '3840х2160 Пикс (Ultra HD)', 'Звук': 'Dolby Digital Plus', 'Размеры': '91.7х145.5х31.3 см', 'Пульт ДУ': 'Комплект/смартфон', 'Встроенный модуль Wi-Fi': 'Да', 'Чтение файлов': 'MP3, H.264, MPEG4, DivX, JPEG', 'Поддержка Smart TV': 'Да', 'USB порт': 'Есть, 2шт', 'HDMI': 'Есть, 3 шт', 'Особенность': 'Технология HDR', 'LAN': 'Есть', 'Разъем для модуля DVB CAM': 'Есть', 'Вес': '25 кг'}"
474,Проектор Xiaomi Mi 4K Laser Projector,Оборудование,Проекторы,"Домашний лазерный проектор Xiaomi располагает схожими с профессиональным оборудованием характеристиками – контрастностью 3000:1, коэффициентом отражения 16-18% - все это делает картинку яркой и сочной и позволяет испытать эффект присутствия, как в настоящем кинотеатре.
Устройство линзы с коэффициентом резкости 0.233:1 позволяет установить проектор всего лишь на расстоянии 5-50 сантиметров от стены. Поставьте проектор на тумбу или просто положите перед стеной и просто наслаждайтесь качеством изображения, не задумываясь о проводах и других неудобствах вроде искажения картинки.
При просмотре видео в кинотеатре часто могут возникать проблемы в сценах с темными, не слишком освященными кадрами, так теряется множество деталей и изображение становится труднее разглядеть. Но с коэффициентом контраста 3000:1, превышающим общепринятый стандарт 2000:1, 4K разрешением и поддержкой HDR, изображение станет ясным и ярким.
Размер картинки проектора Xiaomi составляет 150 дюймов, благодаря чему Вы можете превратить свой дом в настоящий кинотеатр. Размер кадра регулируется в пределах от 80 до 150 дюймов до подходящего размера.
В устройстве применяется технология Аdvanced Laser Fluorescence Display, которая отличается насыщенным и четким изображением благодаря улучшенным качеством яркости и контраста.","['/upload/product/1668/f1335315ff90e83e26445916c42b2a14/full.jpg', '/upload/product/1668/7ef99944ad41cf814c28731cdeaadfd2/full.jpg', '/upload/product/1668/2566dc3e7ddbce0553e68f36eebe829f/full.jpg']","{'Цветовая яркость, лм': '1500 люмен', 'Размер изображения, диагональ': 'от 2.03 до 3.81 м', 'Назначение': 'для домашнего кинотеатра', 'Уровень шума, дБ': '32 дБ', 'Контрастность': '3000:1', 'Поддержка 3D': 'Есть', 'Коррекция трапецеидального искажения по горизонтали/по вертикали': 'есть', 'Разрешение экрана': '3840x2160', 'Встроенный динамик': '30 Вт', 'Встроенный модуль Wi-Fi': 'Да', 'HDMI': 'Есть', 'USB порт': 'USB (тип A)', 'Формат видео': '480i, 480p, 576i, 576p, 720p, 1080i, 1080p, 2160p', 'Размеры': '410x88x291 мм', 'Вес': '7 кг'}"
475,"100"" (255 см) Экран для проектора Lumien Eco View LEV-100102",Оборудование,Проекционные экраны,"Экран для проектора Lumien Eco View LEV-100102 диагональю 100 дюймов сделает просмотр видео ещё более увлекательным! Используйте экран для проведения презентаций или просмотра фильмов дома: большой размер и матовое покрытие, которое исключает световые блики, сделает просмотр комфортным для большого количества аудитории. Lumien Eco View LEV-100102 оснащён креплением на стену и штативом, что делает его невероятно мобильным.","['/upload/product/76/71074581a34b9fa37ae5dadb8d3dd44b/full.jpg', '/upload/product/76/0e9033978fa3ab75d9f147deb5572cae/full.jpg']","{'Диагональ': '100', 'Вес': '10 кг', 'Пульт ДУ': 'Нет', 'Рабочая поверхность': '180x180 см', 'Покрытие': 'Matte White', 'Установка': 'На штативе', 'Штатив': 'Да', 'Механизм автоматической фиксации': 'Есть', 'Проекция': 'Прямая', 'Угол обзора': '160°', 'Коэффициент усиления': '1'}"
476,Проектор XGIMI H2,Оборудование,Проекторы,"XGIMI H2 – это внушительный проектор с невероятными характеристиками! H2 поддерживает воспроизведение FULL HD видео с функцией 3D и различные технологии, такие как компенсация движения, обеспечивающее потрясающее впечатление от просмотра фильмов и даже игр.  Он имеет хорошую яркость и контрастность, при этом максимальный срок службы лампы составляет 30000 часов, и это очень впечатляющий показатель! Так же во время просмотра видео можно не беспокоиться о посторонних звуках работы проектора – его уровень шума ниже 30 дБ! Проектор предоставляется без 3D очков.","['/upload/product/871/e60029d53e652cb9a67b2597e4311eca/full.jpg', '/upload/product/871/929d356385add3c5f8585d87aa8dd2fd/full.jpg', '/upload/product/871/5de726401dfda17e268412ba87a7ac4f/full.jpg', '/upload/product/871/00889f7981da584eb5d279fed5c7e85b/full.jpg']","{'Фокусное расстояние, м': '2.5 м', 'Размер изображения, диагональ': '1.52-7.62 м', 'Разрешение экрана': '1920x1080', 'Фокусировка': 'Авто', 'Встроенный динамик': '32 Вт', 'Встроенный модуль Wi-Fi': 'Да', 'Особенности': 'оперативная память 2 Гб, процессор Mstar 6A928, Bluetooth 4.0, 16 Гб встроенной памяти', 'USB порт': 'Есть', 'Дисплей': 'ЖК \t 0,47 дюйма', 'Процессор': 'Mstar 6A928', 'Размеры': '20x20x12.8 см', 'Вес': '2.1 кг'}"
477,Телевизор LED Hisense H50U7A черный,Аудио- и видеотехника,Телевизоры,"Телевизор LED Hisense H50U7A с огромным экраном отлично подойдёт для ваших презентаций и просмотров кинолент дома! Высокое разрешение и прекрасное качество UHD позволяют полностью погрузится в информацию на экране, будь то фильм или презентация. Благодаря современным технологиям LED Hisense H50U7A сразу распознаёт устройства, находящиеся перед ним и выводит их на экран, предлагая выбрать необходимое для подключения. Поддерживает Smart TV, блок Wi-Fi встроенный, основные приложения уже установлены, для YouTube и Netflix даже предусмотрены отдельные кнопки на пульте.","['/upload/product/1244/a36ed1177d11bbcb1576765ae7a6408a/full.jpg', '/upload/product/1244/1ff5682c7a8de60f49646c56183c2e5a/full.jpg', '/upload/product/1244/15817325e7533a387c4f81809abd46b5/full.jpg', '/upload/product/1244/b0c0d8538a65ec23481238136cb9a845/full.jpg', '/upload/product/1244/9ea7d7dcd680441de0bd7abbc5a61a46/full.jpg', '/upload/product/1244/e1a4329acdf98804d8d9460d8bf4e6a8/full.jpg']","{'Диагональ': '50', 'Разрешение экрана': '4K UltraHD, 3840×2160', 'Звук': '20 Вт', 'Размеры': '1116х723х262 мм', 'Пульт ДУ': 'Да', 'Встроенный модуль Wi-Fi': 'Да', 'Поддержка Smart TV': 'Да', 'USB порт': 'Есть, 2шт', 'HDMI': 'Есть, 4 шт', 'LAN': 'Есть', 'Вес': '18.1 кг'}"
478,Мини-кинотеатр Cinemood Storytеller,Оборудование,Проекторы,"

Мини-кинотеатр Cinemood Storytеller создаст у вас дома атмосферу настоящего кинотеатра! Никаких дополнительных аксессуаров не требуется, вам понадобится только  Storytеller и ровная поверхность. Это отличный выбор для поездки, отдыха на природе или семейного просмотра фильма на большом экране или даже стене! Благодаря компактному размеру кинотеатр можно использовать даже на заднем сидении машины, что спасёт от скуки в поездках. 
",['/upload/product/186/08e349d858e6b1f6f1317d6c9b9ad2b4/full.jpg'],"{'Фокусное расстояние, м': '1-6', 'Размер изображения, диагональ': 'до 3-х метров', 'Фокусировка': 'Оптическая', 'Встроенный модуль Wi-Fi': 'Да', 'Mini-Jack': 'Есть', 'Формат видео': 'mp4, 3gp, avi, mkv, webm, mov, 3g2, 3gpp, asf, divx, f4v, flv, h264, m2ts, m4v, mod, mpeg, mpg, mts, mxf, ogv, wmv.', 'Вес': '260 г'}"
479,Портативная система Behringer EPS500MP3,Аудиотехника,Музыкальные центры,"Портативная система Behringer EPS500MP3 для мощного звучания! Звукоусилительный комплект Behringer EPS500MP3 легко устанавливается и обеспечивает высококачественное воспроизведение звука как в помещении, так и в открытом пространстве. Два усилителя мощностью 250 Вт и 2-полосные динамики создают кристально чистый звук профессионального уровня. Небольшой вес Behringer EPS500MP3 упрощает процесс транспортировки оборудования.",['/upload/product/142/cc851d8b951224bdcddd130fa6b0e1d8/full.jpg'],"{'Мощность': '250 Вт + 250 Вт', 'Тип подключения': 'с проводом, беспроводные', 'Эквалайзер': '2-полосный', 'Чувствительность микрофона': '-54 dBV', 'Аудио выходы': '1/4""TS несбалансированный', 'Микрофон': 'Да', 'Сопротивление': '10 Ом', 'Динамики': '8', 'Питание': '220-240 В, 50/60 Гц', 'Воспроизводимые форматы': 'МР3', 'Размеры': '466 х 276 х 257 мм', 'Вес': '18.8 кг'}"
480,Радиомикрофон RITMIX RWM-221 black,Аудиотехника,Микрофоны,"Набор Ritmix RWM-221 включает в себя два микрофона. Радиус действия микрофонов составляет 60 метров, что позволяет использовать устройство в большом помещении. Идеально подходит для караоке, наличие второго микрофона даёт возможность исполнять любимые песни в дуэте. Широкий диапазон передаваемых частот создают чистое и насыщенное звучание.",['/upload/product/140/81929dbde5eebf0aea901f123a448ded/full.jpg'],"{'Чувствительность': '-60 дБ', 'Диапазон частот': '40 Гц - 20 кГц', 'Тип': 'Динамический', 'Радиус действия': '10 м', 'Сопротивление': '600 Ом', 'Максимальное количество каналов': '2', 'Регулировка громкости': 'Есть', 'Питание': '2 x AA (LR 6)', 'Время автономной работы': 'до 8 часов', 'Интерфейсы': '3 штекера 6.3 мм, 2 выхода 6.3 мм аудио', 'Материал': 'Пластик', 'Рабочие частоты': '87.5 - 92 МГц', 'Индикация разрядки батарей': 'Да', 'Приемный блок': '45х270х156 мм', 'Индикация включения': 'Есть', 'Микрофон': '2 шт, однонаправленные', 'Тип микрофона': 'Мономикрофон; Искажение 0.5 %', 'Длина кабеля, м': '1 м', 'Размеры': '225 x 50 x 50 мм', 'Вес': '227 г'}"
481,Проекционный столик Lumien Vitel,Оборудование,Проекторы,"

Проекционный столик Vitel От компании Lumien станет отличным выбором для проведения вашей презентации. Его лёгкая и манёвренная конструкция позволяет устанавливать проектор в том месте и положении, которое вам необходимо, а также быстро переместить в новую точку ваше оборудование. Функции поворота и наклона позволяют настроить проецирование в нужную вам точку, а небольшие бортики по краяям стола облеспечат безопасность проектора. 
","['/upload/product/1469/eef372b6e4029efa200e65325fc89b3c/full.jpg', '/upload/product/1469/47c39688ceeb206fa420ac2f0035142c/full.jpg']","{'Высота': '80-125 см', 'Максимальная нагрузка': '200 кг', 'Угол наклона': '10', 'Материал': 'Сталь', 'Размеры': '137x60x13 см', 'Вес': '13 кг'}"
482,Офисный стул Изо хром Т (с пюпитром),Столы и стулья,"Стулья, табуретки","

Изо Хром Т (с пюпитром) – классический офисный стул, который прекрасно подойдёт для использования на выставках. Удобный стул с пюпитром - его легко переставить, занимает он совсем немного места. Мягкая обивка стула позволяет комфортно устроиться и не испытывать чувства дискомфорта во время длительных презентаций. Откидной пюпитр позволяет работать с записями, не занимая лишнего пространства. 
",['/upload/product/89/3ac0f2390626699526222d02ba3f6372/full.jpg'],"{'Грузоподъёмность': '120 кг', 'Каркас': 'Немонолитный', 'Регулировка высоты спинки': 'Нет', 'Регулировка по высоте': 'Нет', 'Регулировка угла наклона спинки': 'Нет', 'Синхромеханизм': 'Нет', 'Пюпитр': 'Есть', 'Колеса/опоры для паркета': 'Нет', 'Подголовник': 'Нет', 'Ткань покрытия': 'Искусственная кожа, Ткань стандарт, Сетка'}"
483,Экран для видеопроектора Lumien Master View LMV-100104,Оборудование,Проекционные экраны,"Экран для видеопроектора Lumien Master View LMV-100104 отлично подойдет для использования в организациях и образовательных заведениях. С его применением можно отображать картинку, проводить различные презентации. Данная модель оснащена штативом, который позволяет перемещать изделие при необходимости.","['/upload/product/1410/99f841369a52cb694fa84901fd71eaaf/full.jpg', '/upload/product/1410/585fd3820f87da297b38e1c8db8716bc/full.jpg']","{'Диагональ': '115"" (293 см)', 'Вес': '12 кг', 'Рабочая поверхность': '207x207 см', 'Покрытие': 'Fiberglass Matte White', 'Установка': 'На штативе', 'Штатив': 'Да', 'Электронный привод': 'Нет', 'Проекция': 'прямая', 'Угол обзора': '160°', 'Коэффициент усиления': '1'}"
