id,title,category,subcategory,description,images,specifications
326,"Багажник на рейлинги Thule Smartrack 784 Aero 1,2 м",Автобоксы и багажники,Багажные боксы,Удобный багажник на автомобиль Thule Smartrack 784 Aero (L=120 см) позволит вам взять с собой в поездку всё необходимое! Эта простая конструкция выдерживает большие нагрузки. Багажник легко устанавливается и снимается.,"['/upload/product/124/88f9b13c1953cf26e279241b19d8194c/full.jpg', '/upload/product/124/fc7df83263ca324534dd8ac49bfbe804/full.jpg', '/upload/product/124/184435836b323213ca9f5771b14d1475/full.jpg']","{'Грузоподъёмность': '75 кг', 'Способ крепления': 'На рейлинги'}"
327,"Багажник на рейлинги Menabo Tiger (AVIA) 1,3 м",Автобоксы и багажники,Автомобильные багажники,"Автобагажник Menabo Tiger (AVIA) 1,3 м предназначен для автомобилей с низкими рейлингами лежащими вплотную с крышей, без просвета. Каждая из четырех опор багажника запирается на ключ.",['/upload/product/992/065ce959712f71b80faba995c6c77249/full.jpg'],{'Грузоподъёмность': '100 кг'}
328,Изофикс Britax Römer Baby-Safe i-Size Base,Прогулки и путешествия,Автокресла,"

Специальная база Britax Römer Baby-Safe i-Size Base соответствует современному стандарту безопасности. Она оснащена прочной опорой, которая регулируется по высоте. Благодаря изофиксу вы можете легко установить детское кресло в автомобиль. 
",['/upload/product/289/779a634f3b6f6e53571f76cf7744dd88/full.jpg'],"{'Размеры': '72×44×64 см', 'Вес': '8,7 кг'}"
329,Изофикс Recaro SmartClick,Прогулки и путешествия,Автокресла,"

Изофикс Recaro SmartClick для максимальной безопасности вашего ребёнка в поездке! Изофикс Recaro Smartclick даёт возможность легко и надёжно установить автокресло для малыша с помощью креплений Isofix. Такое крепление увеличивает уровень безопасности, в нём есть индикатор правильности установки кресла, он подстраивается под наклон автомобильного сидения. Совместим с автокреслами Recaro Privia Evo и Recaro Guardia. 
",['/upload/product/128/2c48ca338d1375c107c7ea57f2d1b81c/full.jpg'],{}
330,Детское автокресло Britax Romer King II LS до 18 кг от 0.9 до 4 лет,Прогулки и путешествия,Автокресла,"

Одно из лучших кресел первой категории теперь с функцией светового оповещения о правильности натяжения  ремней безопасности! Многие родители недостаточно туго затягивают ремни, что негативно сказывается на безопасности ребёнка. Благодаря Light System (LS) об этом можно забыть - умная система подскажет, когда ремни затянуты правильно. Анатомически правильная форма кресла делает поездки максимально комфортными, а если ребенок заснул - кресло можно перевести в положение для сна единственным движением. Удобный подголовник и пятиточечные ремни с мягкими накладками обеспечивают дополнительный комфорт и безопасность, их регулировка по высоте осуществляется одной рукой. Чехол кресла легко и быстро снимается для чистки. 
","['/upload/product/66/8920a822e98112f2cafdd8eaec1a41bf/full.jpg', '/upload/product/66/875bbc7db08c4932aaf358bb12be0115/full.jpg', '/upload/product/66/f78385114b6198a50b6bb3a26a1df24a/full.jpg', '/upload/product/66/83392bc5955fef6ab65d869df2c7bb99/full.jpg', '/upload/product/66/f18deca605562ecb6ab643e925e3628a/full.jpg', '/upload/product/66/1ee74963be152791cb611e03f528326c/full.jpg']","{'Группа автокресла': '1', 'Возраст': 'от 9 месяцев до 4 лет', 'Максимальный вес ребёнка': '18 кг', 'Тип крепления': 'Штатный ремень автомобиля', 'Ремни': 'Внутренние 5-точечные ремни', 'Регулировка угла наклона': 'Ступенчатое выдвижение чаши', 'Регулировка высоты подголовника': 'Да', 'Регулировка высоты внутренних ремней': 'Да', 'Дополнительная боковая защита': 'Нет', 'Стандарт Безопасности': 'ECE R 44/04', 'Совместимость с шасси колясок': 'Нет', 'Поворотный механизм': 'Нет', 'Защитный козырек от солнца': 'Нет', 'Подстаканник': 'Нет', 'Анатомическая подушка, вкладыш': 'Нет', 'Использование в качестве переноски': 'Нет', 'Трансформация до бустера': 'Нет', 'Способ крепления': 'По ходу движения', 'Размеры': '67x45x54 см', 'Вес': '10,5 кг'}"
331,Автохолодильник Ezetil ESC-28,Аксессуары и оборудование,Автомобильные холодильники,"Возьмите в путешествие автохолодильник Ezetil ESC-28 для хранения продуктов! В проектировании Ezetil ESC-28 были учтены все детали, чтобы использование автохолодильника было комфортным и эффективным. Это идеальный вариант для автомобильных путешествий и загородных пикников. Модель оборудована системой энергосбережения. Съёмный плечевой ремень упрощает процесс транспортировки. Есть внешние карманы. Шнуры питания вмонтированы в отсек на крышке.",['/upload/product/80/dc36600877b8412d7f05fd537057c2dd/full.jpg'],"{'Объём': '27 л', 'Диапазон создаваемых темп.': '5 - 8*С', ""Режим ''охлаждение''"": 'Есть', 'Количество камер': '1', 'Питание от прикуривателя (12 В)': 'Да', 'Материал': 'пластик/ткань', 'Тип застёжки': 'молния', 'Длина сетевого шнура': '1.6 м', 'Отсек для сетевого шнура': 'Есть', 'Внутр. температура ниже внешней': 'на 20*С', 'Количество карманов': '2', 'Ручка для перемещения': 'Есть', 'Ремень для переноски': 'В комплекте', 'Крышка с фиксацией': 'Да', 'Размеры': '45х37х29 см', 'Вес': '3.5 кг'}"
332,Автобокс Thule Touring Alpine 232x70x42 до 50 кг 430 л,Аксессуары и оборудование,Автобоксы и багажники,"Thule Touring Alpine – настоящая находка для любителей лыжного спорта и других видов зимнего спорта. В него без проблем вмещается до 6-и пар лыж и до 4-х сноубордов длинной до 220 см. Бокс отличается высокой надёжностью и простотой эксплуатации. Двустороннее открытие обеспечивает лёгкий доступ к его содержимому. Простая система монтажа FastClick с поворотной ручкой, которая щелчком сообщает о плотной фиксации бокса. Органично вписывается в дизайн любого автомобиля.","['/upload/product/28/6558a875d9cb55f4e576a50f8476da1c/full.jpg', '/upload/product/28/b0cf2109fc3a0ad19b861b87c160b08c/full.jpg']",{}
333,"Багажник на рейлинги Thule Wingbar Edge 9582 0,83 м",Автобоксы и багажники,Автомобильные крепления,"Для крупных перевозок возьмите в аренду багажник Thule Wingbar Edge 9582! Багажник на рейлинги Thule WingBar Edge 9582 устанавливается на машины с рейлингами. Багажник WingBar Edge 9582 имеет превосходные аэродинамические свойства. Приятный внешний вид багажника органично впишется в дизайн любого автомобиля. В отличие от обычного багажника на рейлинги, данная модель выступает за пределы рейлинга, что является преимуществом.",['/upload/product/34/f68d23e59e7edabe46479218c0915b48/full.jpg'],{'Способ крепления': 'На рейлинги'}
334,Велокрепление на крышу Thule Proride 591,Автобоксы и багажники,Автомобильные крепления,"Надёжное велокрепление на крышу автомобиля Thule Proride 591 позволит взять с собой в путешествие любимый байк! Велокрепление Thule Proride 591 даёт возможность легко и надёжно установить велосипед на крышу автомобиля. Зажимные ручки на небольшой высоте, так что с фиксацией байка и его закрытием на ключ легко справятся даже невысокие люди. Вертикальное крепление обеспечивают держатели рам и подставка для велосипедных колес.","['/upload/product/32/6ffd789655680e33c2e4300988f0b2e8/full.jpg', '/upload/product/32/6b21c65a15de9d2b99ddafcc844ac4cb/full.jpg']","{'Размеры': '145х32х8,5 см', 'Вес': '4,2 кг', 'Количество велосипедов': '1', 'Размеры рам велосипеда': 'от 20 до 80 мм', 'Thule One-Key-System': 'Есть', 'Способ крепления': 'Лапа/Т-профиль/скоба'}"
335,Детское автокресло Recaro Monza Nova 2 Seatfix до 36 кг от 3 до 12 лет,Прогулки и путешествия,Автокресла,"Monza Nova 2 Seatfix для возрастной группы 2-3 (с 15 до 36 кг). По сравнению с предыдущей моделью - боковая защита усилена дополнительными вставками из специального материала. По-прежнему сиденье кресла остаётся одним из самых широких и мягких в своей возрастной группе. Оно имеет правильную эргономичную форму и обеспечивает максимально комфортную посадку. Спинку можно слегка откинуть, чтобы во время сна голова ребёнка не падала вперёд. В боковинах предусмотрены вентиляционные отверстия, которые обеспечивают оптимальный микроклимат. Для большего комфорта в подголовник кресла встроена воздушная подушка, которую можно накачать или сдуть. Специальная система RECARO Sound System со встроенными в подголовник динамиками может быть подключена к МР-3 плееру, смартфону или планшету и позволяет ребенку наслаждаться собственными аудио и видео записями, не отвлекая остальных пассажиров. Recaro Monza Nova Seatfix устанавливается в автомобиле с использованием дополнительных креплений ISOFIX.","['/upload/product/61/5b4ef8098fe9644417e39dfad691e51d/full.jpg', '/upload/product/61/d583c1d7c77d81a8b77ee65d5cd549c9/full.jpg', '/upload/product/61/fa095d7ff0da3f3bfa65c07ce32dcdef/full.jpg']","{'Группа автокресла': '2-3', 'Возраст': 'от 3 до 12 лет', 'Максимальный вес ребёнка': '36 кг.', 'Тип крепления': 'База ISOFIX или штатный ремень автомобиля', 'Ремни': 'Штатный ремень автомобиля', 'Регулировка угла наклона': 'Плавающая спинка', 'Регулировка высоты подголовника': 'Да', 'Регулировка высоты внутренних ремней': 'Нет', 'Дополнительная боковая защита': 'Нет', 'Стандарт Безопасности': 'ECE R 44/04', 'Совместимость с шасси колясок': 'Нет', 'Поворотный механизм': 'Нет', 'Защитный козырек от солнца': 'Нет', 'Подстаканник': 'Нет', 'Анатомическая подушка, вкладыш': 'Нет', 'Использование в качестве переноски': 'Нет', 'Трансформация до бустера': 'Да', 'Размеры': '74х55х48 см', 'Вес': '6,5 кг'}"
336,Детское автокресло Recaro Young Sport Hero до 36 кг от 0.9 до 2 лет,Прогулки и путешествия,Автокресла,"Ультрасовременная,  стильная и безопасная модель от популярного производителя. Имеет яркий дизайн, который станет украшением салона самого высокого класса. По безопасности кресло является воплощением современных технологий. Уникальная, усовершенствованная боковая защита, усиленный каркас, выверенная эргономика спинки и подголовника, комфортный регулируемый подголовник и развитый наклон для отдыха до 30 градусов — все это обеспечивает высочайший комфорт и безопасность для малыша. Ребенок до 18 кг фиксируется внутренними 5-точечными ремнями с мягкими накладками. После 18 кг или при достижении роста 1 метр, ребенок вместе с креслом пристегивается штатным ремнем автомобиля. Регулировка ремня по высоте осуществляется вместе с подголовником.  Удобная ручка для переноски и крупные элементы регулировок дополняют дизайн и эргономику кресла. Все чехлы снимаются для деликатной стирки. Автокресло крепится штатным ремнем автомобиля лицом по ходу движения.","['/upload/product/63/ef15fa8a84d6fae1b63a44157a02d04f/full.jpg', '/upload/product/63/2184105e41defe61d33fe4f75643dbaf/full.jpg', '/upload/product/63/94dc2dff9f4a6982314b3d05cbc9d5c9/full.jpg', '/upload/product/63/e04e058702e3c574ce33b144ddde4036/full.jpg', '/upload/product/63/553467c65ecb58c86baffea5b46308e9/full.jpg', '/upload/product/63/6b72872ab2f30a9d1be4998aa8bc5823/full.jpg']","{'Группа автокресла': '1-2-3', 'Возраст': 'от 9 месяцев до 2 лет', 'Максимальный вес ребёнка': '36 кг', 'Тип крепления': 'Штатный ремень автомобиля', 'Ремни': 'Внутренние 5- точечные ремни / штатный ремень авто', 'Регулировка угла наклона': 'Упор под сидением', 'Регулировка высоты подголовника': 'Да', 'Регулировка высоты внутренних ремней': 'Да', 'Дополнительная боковая защита': 'Нет', 'Стандарт Безопасности': 'ECE R 44/04', 'Совместимость с шасси колясок': 'Нет', 'Поворотный механизм': 'Нет', 'Защитный козырек от солнца': 'Нет', 'Подстаканник': 'Нет', 'Анатомическая подушка, вкладыш': 'Да', 'Использование в качестве переноски': 'Нет', 'Трансформация до бустера': 'Нет', 'Размеры': '52х64х56 см', 'Вес': '8,8 кг'}"
337,"Автобокс Thule Motion XT XL 215x91,5x44 до 75 кг 500 л",Аксессуары и оборудование,Автобоксы и багажники,"Не перегружайте багажник своего автомобиля, возьмите в аренду автобокс Thule Motion XT XL! Автобокс Thule Motion XT XL подходит для перевозки лыж длиной до 2 м, коробок и сумок высотой до 39 см. Продуманный дизайн автобокса отлично сочетается с любым автомобилем, при этом не влияет на его аэродинамические характеристики. Технология Power-Click даёт возможность легко устанавливать автобокс, для этого вам не понадобятся даже инструменты. Бокс открывается с обеих сторон, что обеспечивает лёгкий доступ к его содержимому. Thule Motion XT XL идеально подойдёт для выездов на природу всей семьёй, ведь в нём без проблем умещаются до 7 пар лыж и 5 сноубордов.","['/upload/product/27/3dc17224df154a159b301d056eeee800/full.jpg', '/upload/product/27/db54873b1cf344556795d31b62241bbe/full.jpg', '/upload/product/27/f17dc658d62152485f5a19174ce0de23/full.jpg', '/upload/product/27/041a237427b1ab423e1b6418439b3a48/full.jpg']",{}
338,Велокрепление на заднюю дверь Thule 9104,Автобоксы и багажники,Автомобильные крепления,Надёжное велокрепление на заднюю дверь автомобиля Thule 9104 позволит взять с собой в путешествие любимый байк!,['/upload/product/21/11e6f4219dfaa8d6e1278e669292088f/full.jpg'],"{'Размеры': '57 x 82 x 116 см', 'Количество велосипедов': '3', 'Размеры в сложенном виде': '57 x 18 x 117 см', 'Размеры рам велосипеда': 'Без ограничений', 'Способ крепления': 'Snap-On'}"
339,Бустер Chicco Quasar Plus Astral,Прогулки и путешествия,Автокресла,"Отличный бустер, который сертифицирован на группы от 15 до 25 кг и от 25 до 36 кг. С бустером Chicco Quasar Plus Astral перевозка ребёнка будет максимально комфортной, а также безопасной. Не сомневайтесь, даже самый настоящий непоседа будет доволен таким удобным и стильным креслом!","['/upload/product/698/0a25199c18ef735c6b1da07a07ba8afd/full.jpg', '/upload/product/698/0f0c2f775583182909af749041ac23f6/full.jpg', '/upload/product/698/40743ac90c08065e98c7e57b38a9778d/full.jpg']","{'Тип крепления': 'Штатный ремень автомобиля', 'Способ крепления': 'Штатный ремень автомобиля', 'Размеры': '21 X 40 X 45 см', 'Вес': '1220 гр'}"
340,Автобокс Thule Touring S 139x90x40 до 50 кг 330 л,Аксессуары и оборудование,Автобоксы и багажники,"Не перегружайте багажник своего автомобиля, возьмите в аренду автобокс Thule Touring S! Отличительные особенности автобокса Thule Touring S: надёжность, практичность и простота в использовании. Система центрального замка надёжно защищает содержимое автобокса от кражи. Крепление FastClick с поворотной ручкой, которая щелчком сообщает о плотной фиксации бокса.  Автобокс Thule Touring S имеет внутренний объём 330 л. и рассчитан на грузоподъемность до 50 кг. Отлично вписывается в дизайн любого автомобиля.","['/upload/product/26/43b45a925d3359948fbae2959beed97d/full.jpg', '/upload/product/26/0833cc5aecca5819270e30aa5742d719/full.jpg', '/upload/product/26/1343126646fed6b9f2418696edd5b478/full.jpg', '/upload/product/26/63c8cbdf8fe52a6f9c5f3851a5d797c6/full.jpg']",{}
341,Велокрепление на заднюю дверь Thule 9105,Автобоксы и багажники,Автомобильные крепления,Надёжное велокрепление на заднюю дверь автомобиля Thule 9105 позволит взять с собой в путешествие любимый байк!,"['/upload/product/20/6af8073150e6b3ac6ee25940ddf38988/full.jpg', '/upload/product/20/1776a719ca102120882328c8ef770103/full.jpg']","{'Размеры': '144 x 65 x 97 см', 'Количество велосипедов': '2', 'Размеры в сложенном виде': '24 x 97 x 116 см', 'Размеры рам велосипеда': '22–80 мм', 'Thule One-Key-System': 'Есть', 'Способ крепления': 'с помощью съемных держателей рамы'}"
342,Автодержатель для планшета с креплением на подголовник Ppyple HR-NT,Ppyple,Компьютерная техника,"Удобный держатель для планшетов с диагональю дисплея от 5 до 11 дюймов. Держатель прочно крепится на подголовник кресла и сохраняет своё положение даже на высокой скорости автомобиля. Планшет оказывается на уровне глаз пассажира, в полном его доступе. Автодержатель для планшета с креплением на подголовник Ppyple HR-NT сделает поездку ваших пассажиров более интересной и полезной!",['/upload/product/132/594c7f4fd79492c1f9543b2787044d73/full.jpg'],{}
